[
  {
    "slug": "archify",
    "name": "Archify",
    "repo": "tt-a1i/archify",
    "github_url": "https://github.com/tt-a1i/archify",
    "website_url": "https://jianailab.com/projects/archify",
    "category": "AI 编程与建站",
    "summary_zh": "让编程 Agent 把代码库变成可核验、可交互、可导出的专业架构图。",
    "source_url": "https://x.com/t20000622yy/status/2092793107129749634",
    "signal": "GitHub Trending Today #1",
    "stars_snapshot": 19100,
    "language": "JavaScript",
    "license": "MIT",
    "checked_at": "2026-08-27"
  },
  {
    "slug": "matt-skills-with-to-goal",
    "name": "Matt Skills with To-Goal",
    "repo": "tt-a1i/matt-skills-with-to-goal",
    "github_url": "https://github.com/tt-a1i/matt-skills-with-to-goal",
    "website_url": "https://jianailab.com/projects/matt-skills-with-to-goal",
    "category": "AI 编程与建站",
    "summary_zh": "把已经谈清楚的开发任务压成可验证合同，交给新会话或执行分身直接完成并回传证据。",
    "source_url": "https://x.com/t20000622yy/status/2090243632557400506",
    "signal": "作者工作流说明",
    "stars_snapshot": 94,
    "language": "未核验",
    "license": "MIT",
    "checked_at": "2026-08-27"
  },
  {
    "slug": "open-notebook",
    "name": "Open Notebook",
    "repo": "lfnovo/open-notebook",
    "github_url": "https://github.com/lfnovo/open-notebook",
    "website_url": "https://jianailab.com/projects/open-notebook",
    "category": "写作与知识整理",
    "summary_zh": "把多种资料变成可本地运行的私人 AI 研究助手。",
    "source_url": "https://x.com/VaibhavSisinty/status/2089043855689805834",
    "signal": "X discovery",
    "stars_snapshot": 37718,
    "language": "TypeScript",
    "license": "MIT",
    "checked_at": "2026-08-27"
  },
  {
    "slug": "no-ai-slop",
    "name": "No AI Slop",
    "repo": "petergyang/no-ai-slop",
    "github_url": "https://github.com/petergyang/no-ai-slop",
    "website_url": "https://jianailab.com/projects/no-ai-slop",
    "category": "写作与知识整理",
    "summary_zh": "检测并清理 20 多类常见 AI 写作套路。",
    "source_url": "https://x.com/VaibhavSisinty/status/2089043867534516555",
    "signal": "X discovery",
    "stars_snapshot": 6143,
    "language": "Python",
    "license": "MIT",
    "checked_at": "2026-08-27"
  },
  {
    "slug": "open-seo",
    "name": "OpenSEO",
    "repo": "every-app/open-seo",
    "github_url": "https://github.com/every-app/open-seo",
    "website_url": "https://jianailab.com/projects/open-seo",
    "category": "内容创作与自媒体",
    "summary_zh": "自托管关键词研究、排名跟踪、SEO 审计和竞品分析。",
    "source_url": "https://x.com/VaibhavSisinty/status/2089043891005932013",
    "signal": "X discovery",
    "stars_snapshot": 13631,
    "language": "TypeScript",
    "license": "MIT",
    "checked_at": "2026-08-27"
  },
  {
    "slug": "omniroute",
    "name": "OmniRoute",
    "repo": "diegosouzapw/OmniRoute",
    "github_url": "https://github.com/diegosouzapw/OmniRoute",
    "website_url": "https://jianailab.com/projects/omniroute",
    "category": "Agent、自动化、数据与本地部署",
    "summary_zh": "给编程 Agent 接入多模型网关，并在额度或服务失败时自动换线路。",
    "source_url": "https://x.com/VaibhavSisinty/status/2089043914527482112",
    "signal": "X discovery",
    "stars_snapshot": 56488,
    "language": "TypeScript",
    "license": "MIT",
    "checked_at": "2026-08-27"
  },
  {
    "slug": "ai-job-search",
    "name": "AI Job Search",
    "repo": "MadsLorentzen/ai-job-search",
    "github_url": "https://github.com/MadsLorentzen/ai-job-search",
    "website_url": "https://jianailab.com/projects/ai-job-search",
    "category": "职场办公提效",
    "summary_zh": "用本地 Claude Code 工作流评估岗位、定制简历并准备面试。",
    "source_url": "https://x.com/VaibhavSisinty/status/2089043926355415409",
    "signal": "X discovery",
    "stars_snapshot": 36869,
    "language": "Python",
    "license": "MIT",
    "checked_at": "2026-08-27"
  },
  {
    "slug": "strix",
    "name": "Strix",
    "repo": "usestrix/strix",
    "github_url": "https://github.com/usestrix/strix",
    "website_url": "https://jianailab.com/projects/strix",
    "category": "AI 编程与建站",
    "summary_zh": "让 AI Agent 对获授权应用做安全测试并交付漏洞证据。",
    "source_url": "https://x.com/VaibhavSisinty/status/2089043938179174429",
    "signal": "X discovery",
    "stars_snapshot": 58667,
    "language": "Python",
    "license": "Apache-2.0",
    "checked_at": "2026-08-27"
  },
  {
    "slug": "open-generative-ai",
    "name": "Open Generative AI",
    "repo": "Anil-matcha/Open-Generative-AI",
    "github_url": "https://github.com/Anil-matcha/Open-Generative-AI",
    "website_url": "https://jianailab.com/projects/open-generative-ai",
    "category": "视频、图片与声音",
    "summary_zh": "把 500 多个图像、视频与口型同步模型放进统一工作台。",
    "source_url": "https://x.com/VaibhavSisinty/status/2089043950099444131",
    "signal": "X discovery",
    "stars_snapshot": 27216,
    "language": "JavaScript",
    "license": "MIT",
    "checked_at": "2026-08-27"
  },
  {
    "slug": "freecut",
    "name": "Freecut",
    "repo": "Moh4696/freecut",
    "github_url": "https://github.com/Moh4696/freecut",
    "website_url": "https://jianailab.com/projects/freecut",
    "category": "视频、图片与声音",
    "summary_zh": "让编程 Agent 参与剪辑、字幕、转场和动画叠加。",
    "source_url": "https://x.com/exploraX_/status/2072277788967481683",
    "signal": "X discovery",
    "stars_snapshot": 271,
    "language": "Python",
    "license": "MIT",
    "checked_at": "2026-08-27"
  },
  {
    "slug": "pentest-ai",
    "name": "Pentest AI",
    "repo": "0xSteph/pentest-ai",
    "github_url": "https://github.com/0xSteph/pentest-ai",
    "website_url": "https://jianailab.com/projects/pentest-ai",
    "category": "AI 编程与建站",
    "summary_zh": "复测每个 AI 发现的漏洞并附可重放证据包。",
    "source_url": "https://x.com/Manfridayy/status/2092887388100178236",
    "signal": "X discovery",
    "stars_snapshot": 1629,
    "language": "Python",
    "license": "MIT",
    "checked_at": "2026-08-27"
  },
  {
    "slug": "agent-orchestrator",
    "name": "Agent Orchestrator",
    "repo": "Untrivial-ai/agent-orchestrator",
    "github_url": "https://github.com/Untrivial-ai/agent-orchestrator",
    "website_url": "https://jianailab.com/projects/agent-orchestrator",
    "category": "AI 编程与建站",
    "summary_zh": "在一张 Agent IDE 里调度编程 Agent、CI 修复、冲突与审查。",
    "source_url": "https://x.com/Maaztwts/status/2092883442082214011",
    "signal": "X discovery",
    "stars_snapshot": 9985,
    "language": "Go",
    "license": "Apache-2.0",
    "checked_at": "2026-08-27"
  },
  {
    "slug": "gitnexus",
    "name": "GitNexus",
    "repo": "abhigyanpatwari/GitNexus",
    "github_url": "https://github.com/abhigyanpatwari/GitNexus",
    "website_url": "https://jianailab.com/projects/gitnexus",
    "category": "AI 编程与建站",
    "summary_zh": "把整座代码库变成浏览器里的关系图，再用 Graph RAG Agent 追踪调用链。",
    "source_url": "https://x.com/ProductHunt/status/2093054760228434331",
    "signal": "GitHub Trending Today #5",
    "stars_snapshot": 46236,
    "language": "TypeScript",
    "license": "NOASSERTION（GitHub API 未识别）",
    "checked_at": "2026-08-29"
  },
  {
    "slug": "cursor-plugins",
    "name": "Cursor Plugins",
    "repo": "cursor/plugins",
    "github_url": "https://github.com/cursor/plugins",
    "website_url": "https://jianailab.com/projects/cursor-plugins",
    "category": "AI 编程与建站",
    "summary_zh": "让 Cursor 直接调用邮件、网盘、日历、GitHub、浏览器和审查等官方插件。",
    "source_url": "https://x.com/cursor_ai/status/2085464617694777762",
    "signal": "GitHub Trending Today #8",
    "stars_snapshot": 6030,
    "language": "TypeScript",
    "license": "MIT",
    "checked_at": "2026-08-29"
  },
  {
    "slug": "openlogi",
    "name": "OpenLogi",
    "repo": "AprilNEA/OpenLogi",
    "github_url": "https://github.com/AprilNEA/OpenLogi",
    "website_url": "https://jianailab.com/projects/openlogi",
    "category": "职场办公提效",
    "summary_zh": "本地配置罗技设备的按键、DPI 和 SmartShift，不要账号，也不要遥测。",
    "source_url": "https://x.com/GithubProjects/status/2061032448151183561",
    "signal": "X discovery",
    "stars_snapshot": 17479,
    "language": "Rust",
    "license": "Apache-2.0",
    "checked_at": "2026-08-29"
  },
  {
    "slug": "openhuman",
    "name": "OpenHuman",
    "repo": "tinyhumansai/openhuman",
    "github_url": "https://github.com/tinyhumansai/openhuman",
    "website_url": "https://jianailab.com/projects/openhuman",
    "category": "AI 新手起步",
    "summary_zh": "把个人记忆、深度研究和多 Agent 工作流装进一个本地优先的 AI 工作台。",
    "source_url": "https://x.com/tinyhumansai",
    "signal": "X discovery",
    "stars_snapshot": 38763,
    "language": "Rust",
    "license": "GPL-3.0",
    "checked_at": "2026-08-29"
  },
  {
    "slug": "freellmapi",
    "name": "FreeLLMAPI",
    "repo": "tashfeenahmed/freellmapi",
    "github_url": "https://github.com/tashfeenahmed/freellmapi",
    "website_url": "https://jianailab.com/projects/freellmapi",
    "category": "AI 新手起步",
    "summary_zh": "把多家免费模型层接到一个 OpenAI 兼容接口，并自动回退。",
    "source_url": "https://x.com/unwind_ai_/status/2092442471435534504",
    "signal": "GitHub Trending Today #13",
    "stars_snapshot": 21769,
    "language": "TypeScript",
    "license": "MIT",
    "checked_at": "2026-08-29"
  },
  {
    "slug": "music-assistant",
    "name": "Music Assistant",
    "repo": "music-assistant/server",
    "github_url": "https://github.com/music-assistant/server",
    "website_url": "https://jianailab.com/projects/music-assistant",
    "category": "视频、图片与声音",
    "summary_zh": "把流媒体、本地曲库和多品牌联网音箱放进同一套播放系统。",
    "source_url": "https://x.com/home_assistant/status/2064784746064879793",
    "signal": "X discovery",
    "stars_snapshot": 3008,
    "language": "Python",
    "license": "Apache-2.0",
    "checked_at": "2026-08-29"
  },
  {
    "slug": "awesome-agent-skills",
    "name": "Awesome Agent Skills",
    "repo": "VoltAgent/awesome-agent-skills",
    "github_url": "https://github.com/VoltAgent/awesome-agent-skills",
    "website_url": "https://jianailab.com/projects/awesome-agent-skills",
    "category": "AI 新手起步",
    "summary_zh": "从一千多个跨客户端 Skills 里按用途找现成能力。",
    "source_url": "https://x.com/sitinme/status/2093250482118824400",
    "signal": "GitHub Trending This week",
    "stars_snapshot": 33122,